{
  "ajar_version": "0.1",
  "type": "mandate",
  "id": "urn:uuid:11111111-1111-4111-8111-111111111111",
  "issuer": {
    "kind": "principal",
    "key": {
      "kty": "OKP",
      "crv": "Ed25519",
      "x": "principalBuyerPublicKey001",
      "kid": "principal-2026"
    }
  },
  "subject": {
    "kind": "agent",
    "operator": "https://agent.example",
    "key": {
      "kty": "OKP",
      "crv": "Ed25519",
      "x": "agentOperatorPublicKey001",
      "kid": "agent-2026"
    }
  },
  "scopes": ["commerce.purchase.transport", "content.read.*"],
  "caps": {
    "per_tx": {
      "INR": 200000
    },
    "total": {
      "INR": 200000
    },
    "count": 1
  },
  "constraints": {
    "domains_allow": ["*.examplerail.example"],
    "risk_max": "R3",
    "forbidden": ["commerce.cancel.*"]
  },
  "valid_from": "2026-07-01T00:00:00Z",
  "valid_until": "2026-07-31T23:59:59Z",
  "delegation": {
    "chain": [],
    "sub_delegation": false
  },
  "revocation": {
    "endpoint": "https://principal.example/ajar/revocations",
    "cached_ttl": "PT10M"
  },
  "signature": {
    "alg": "Ed25519",
    "kid": "principal-2026",
    "sig": "mandateTicketScenarioSignature001"
  }
}
